{
  "schema": "omni.router.route_test.v1",
  "query": "git commit",
  "count": 1,
  "threshold": 0.4,
  "limit": 5,
  "confidence_profile": { "name": "balanced", "source": "active-profile" },
  "stats": {
    "semantic_weight": 1.0,
    "keyword_weight": 1.5,
    "rrf_k": 10,
    "strategy": "weighted_rrf_field_boosting"
  },
  "results": [
    {
      "id": "git.commit",
      "description": "Commit changes",
      "skill_name": "git",
      "tool_name": "git.commit",
      "command": "commit",
      "score": 0.82,
      "final_score": 0.91,
      "confidence": "high",
      "routing_keywords": ["git", "commit"],
      "input_schema": { "type": "object" },
      "payload": {
        "type": "command",
        "description": "Commit changes",
        "metadata": {
          "tool_name": "git.commit",
          "routing_keywords": ["git", "commit"],
          "input_schema": { "type": "object" }
        }
      }
    }
  ]
}
